{
  "id": "gm/adventure/crime-interested",
  "title": "Interested Parties",
  "pillar": "gm",
  "tags": [
    "fantasy"
  ],
  "credits": [
    {
      "source": "r/d100",
      "url": "https://www.reddit.com/r/d100/"
    },
    {
      "source": "r/BehindTheTables",
      "url": "https://www.reddit.com/r/BehindTheTables/"
    },
    {
      "source": "r/DnDBehindTheScreen",
      "url": "https://www.reddit.com/r/DnDBehindTheScreen/"
    },
    {
      "source": "DnDSpeak",
      "url": "http://dndspeak.com/"
    }
  ],
  "entries": [
    "a family member",
    "{pick:a spouse|a lover|an ex}",
    "a guild",
    "government involvement",
    "a religious institution",
    "the town's people",
    "an influential local",
    "a stranger"
  ]
}
