{
  "id": "gm/loot/map-marker-1",
  "title": "Map First Markers",
  "pillar": "gm",
  "tags": [
    "fantasy"
  ],
  "credits": [
    {
      "source": "r/d100",
      "url": "https://www.reddit.com/r/d100/"
    },
    {
      "source": "r/BehindTheTables",
      "url": "https://www.reddit.com/r/BehindTheTables/"
    },
    {
      "source": "r/DnDBehindTheScreen",
      "url": "https://www.reddit.com/r/DnDBehindTheScreen/"
    },
    {
      "source": "DnDSpeak",
      "url": "http://dndspeak.com/"
    }
  ],
  "entries": [
    "mountain shaped like a tooth",
    "hill shaped like a saddle",
    "cliffs of red stone",
    "tiny caves in a white hill",
    "old fortress ruins",
    "dried up creekbed",
    "swift-running river",
    "waterfall",
    "abandoned village",
    "tree with a large hole in it",
    "toppled statue of (Deity)",
    "landslide of shale and gravel",
    "steep-sided valley with blue flowers",
    "beach strewn with black seashells",
    "broken remains of a watchtower",
    "road marker pointing east",
    "dilapidated hunter's shack",
    "crossroads",
    "hand-cut stairway into the hillside",
    "canyon with natural stairs leading down",
    "strange rock formation resembling a dragon's head",
    "mysterious cave entrance with glowing markings",
    "ancient stone circle surrounded by ancient symbols",
    "crystal-clear underground pool hidden in a cavern",
    "grove of trees with silver leaves and golden bark",
    "large stone archway leading to an unknown realm",
    "ruins of an ancient library filled with forgotten knowledge",
    "giant stone door with inscriptions and a missing key",
    "sunken shipwreck with remnants of a valuable cargo",
    "whispering grove where the trees seem to speak",
    "eerie silence of a hidden burial ground",
    "sacred shrine with offerings left by pilgrims",
    "ancient stone monolith with celestial engravings",
    "underground labyrinth with a glowing crystal compass",
    "entrance to a labyrinth guarded by stone statues",
    "meandering path through a forest of colorful mushrooms",
    "towering tree with branches forming an intricate pattern",
    "series of glowing crystals leading deeper into the earth",
    "ghostly apparitions of a forgotten battlefield",
    "abandoned mine with the remnants of forgotten treasures",
    "hidden chamber filled with shimmering gemstones",
    "eerie fog-shrouded swamp with unknown creatures lurking",
    "hidden garden with plants that bloom only once in a century",
    "hidden valley where time seems to stand still",
    "underground chamber with an ancient map etched on the walls",
    "portal shimmering with energy, leading to unknown realms",
    "ancient tree with carvings detailing a legendary tale",
    "forgotten altar atop a hill with offerings of the past",
    "peculiar formation of rocks resembling a celestial map",
    "serene grove filled with bioluminescent fireflies at night",
    "abandoned observatory with a telescope pointing skyward",
    "hidden hot spring with rejuvenating and healing properties",
    "ancient stone bridge spanning a wide and rushing river",
    "massive hollow tree housing an ecosystem of unique creatures",
    "cave filled with ancient hieroglyphs and mysterious symbols",
    "majestic waterfall cascading into a shimmering pool below",
    "ancient sundial marking the passage of time with precision",
    "statue garden with lifelike statues that seem to follow you",
    "sprawling labyrinth of interconnected underground tunnels",
    "petrified forest where trees appear frozen in time and stone",
    "ethereal glade with floating orbs of light guiding the way",
    "forgotten crypt filled with the whispers of lost souls",
    "hidden sanctuary protected by ancient warding spells",
    "underground river leading to an uncharted subterranean lake",
    "clearing where the stars align to form a celestial pattern",
    "ruined castle with crumbling walls and a dark past",
    "shimmering aurora dancing across the night sky, illuminating the path"
  ]
}
