{
  "id": "solo/colostle/nature",
  "title": "Character Nature",
  "pillar": "solo",
  "tags": [
    "colostle"
  ],
  "credits": [
    {
      "source": "Colostle solo-RPG community & original companion tables"
    },
    {
      "source": "Colostle © Nich Angell — rulebook required to play",
      "url": "https://www.colostle.com/"
    }
  ],
  "entries": [
    "Happy-go-lucky, extremely optimistic, fun",
    "Impatient, quick-to-anger, grumpy",
    "Brave, by-the-book, serious, no sense of humour",
    "Introspective, quiet, mysterious, person of few words",
    "Larger than life, tells exaggerated stories, roars with laughter",
    "Sly, strategic and always planning",
    "Salt-of-the-earth, common folk, finds it easy to talk with anyone",
    "Calm, composed, unshakable in difficult situations",
    "Eccentric, quirky, often lost in thought about peculiar topics",
    "Charming, smooth-talker, knows how to win people over",
    "Hot-tempered, fierce, fiercely protective of loved ones",
    "Free-spirited, adventurous, always seeking new experiences",
    "Wise, sage-like, imparts valuable life lessons to others",
    "Energetic, restless, always on the move and looking for action",
    "Nurturing, caring, takes care of others as if they were family",
    "Reserved, shy, takes time to open up to new people",
    "Analytical, logical, approaches problems with a rational mindset",
    "Empathetic, compassionate, understands and feels others’ emotions deeply",
    "Witty, sharp-tongued, uses humor to disarm or tease others",
    "Determined, persistent, never gives up in the face of challenges",
    "Adventurous, thrill-seeker, always seeking the next adrenaline rush",
    "Honest, straightforward, values truth and integrity above all else",
    "Curious, inquisitive, always seeking knowledge and understanding",
    "Charismatic, charming, can persuade others with ease",
    "Stoic, stoic, keeps emotions hidden and maintains a composed exterior",
    "Playful, mischievous, enjoys pranks and light-hearted fun",
    "Compassionate, caring, always there to lend a helping hand",
    "Enigmatic, mysterious, others struggle to understand their true motives",
    "Optimistic, sees the silver lining in even the darkest situations",
    "Diligent, hardworking, always gives their best effort in everything they do",
    "Innovative, creative, thinks outside the box to solve problems",
    "Loyal, devoted, fiercely stands by their friends and allies",
    "Resolute, unwavering, sticks to their principles no matter the cost",
    "Chill, laid-back, goes with the flow and doesn’t let things bother them",
    "Independent, self-reliant, prefers to do things on their own",
    "Daring, bold, unafraid to take risks for the greater good",
    "Analytical, keen observer, notices details that others miss",
    "Gentle, kind-hearted, treats others with gentleness and compassion",
    "Confident, self-assured, believes in themselves and their abilities",
    "Mysterious, enigmatic, others can never quite figure them out",
    "Assertive, strong-willed, always takes charge in a crisis",
    "Easygoing, adaptable, able to adjust to any situation with ease",
    "Idealistic, believes in a better world and works to make it a reality",
    "Fierce, fierce, fiercely protective of their loved ones",
    "Eccentric, quirky, marches to the beat of their own drum",
    "Humble, modest, never brags about their accomplishments",
    "Resourceful, inventive, always finds creative solutions to problems",
    "Patient, calm, never rushes into decisions and carefully weighs options",
    "Cheerful, bright, always has a smile on their face",
    "Focused, determined, keeps their eye on the prize",
    "Perceptive, intuitive, can read people and situations with ease",
    "Diplomatic, tactful, skilled at resolving conflicts and finding common ground",
    "Courageous, fearless, unafraid to face danger head-on",
    "Reliable, dependable, always comes through for their friends",
    "Quirky, eccentric, has unique habits and interests",
    "Steadfast, unwavering, remains loyal to their beliefs and values",
    "Thoughtful, considerate, puts others’ needs before their own",
    "Adventurous, thrill-seeker, always seeking excitement and new challenges",
    "Cautious, vigilant, takes calculated risks to avoid unnecessary danger",
    "Witty, clever, has a sharp and quick sense of humor",
    "Empathetic, compassionate, deeply cares about the well-being of others",
    "Daring, audacious, willing to take bold actions to achieve their goals",
    "Adaptable, flexible, can adjust to new situations and environments with ease",
    "Inquisitive, curious, always eager to learn and explore",
    "Optimistic, positive, always looks on the bright side of life",
    "Focused, determined, sets clear goals and works tirelessly to achieve them"
  ],
  "description": "A personality in a phrase for a Colostle explorer."
}
