{
  "id": "gm/npc/feature-ears",
  "title": "Features — Ears",
  "pillar": "gm",
  "tags": [
    "fantasy"
  ],
  "credits": [
    {
      "source": "r/d100",
      "url": "https://www.reddit.com/r/d100/"
    },
    {
      "source": "r/BehindTheTables",
      "url": "https://www.reddit.com/r/BehindTheTables/"
    },
    {
      "source": "r/DnDBehindTheScreen",
      "url": "https://www.reddit.com/r/DnDBehindTheScreen/"
    },
    {
      "source": "DnDSpeak",
      "url": "http://dndspeak.com/"
    }
  ],
  "entries": [
    "Over-sized",
    "Long lobes",
    "Small",
    "Uneven",
    "Hairy",
    "Pointy",
    "Short lobes",
    "Stick out",
    "Jug-handle",
    "Elaborately pierced",
    "Cauliflower-like",
    "Delicately curved",
    "Elven-shaped",
    "Angular",
    "Torn",
    "Scarred",
    "Graceful",
    "Ragged",
    "Glowing runes inscribed",
    "Winged",
    "Webbed",
    "Delicate engravings",
    "Gilded edges",
    "Giant-sized",
    "Magically enhanced",
    "Crystal-like",
    "Marble-patterned",
    "Gossamer-thin",
    "Ceramic",
    "Sculpted with intricate patterns",
    "Noble crest engraved",
    "Leathery",
    "Serrated edges",
    "Petite and dainty",
    "Bark-like",
    "Moss-covered",
    "Vibrant colors",
    "Covered in ancient symbols",
    "Tattooed with arcane markings",
    "Crystalline",
    "Shimmering with magic",
    "Velvet-textured",
    "Embedded with gemstones",
    "Copper filigree",
    "Furry",
    "Gilded with gold leaf",
    "Mechanical",
    "Floral patterns etched"
  ]
}
