{
  "id": "gm/npc/prophecy-warning-phrase",
  "title": "Prophecy Warning Phrases",
  "pillar": "gm",
  "tags": [
    "fantasy"
  ],
  "credits": [
    {
      "source": "r/d100",
      "url": "https://www.reddit.com/r/d100/"
    },
    {
      "source": "r/BehindTheTables",
      "url": "https://www.reddit.com/r/BehindTheTables/"
    },
    {
      "source": "r/DnDBehindTheScreen",
      "url": "https://www.reddit.com/r/DnDBehindTheScreen/"
    },
    {
      "source": "DnDSpeak",
      "url": "http://dndspeak.com/"
    }
  ],
  "entries": [
    "Beware",
    "Guard against",
    "Stay vigilant for",
    "Avoid",
    "Protect against",
    "Brace yourself against",
    "Shield from",
    "Stay wary of",
    "Shun the company of",
    "Arm yourself against",
    "Never trust",
    "Ensure you recognize",
    "Ready your defenses against",
    "Remember always to resist",
    "Do not be swayed by"
  ]
}
