{
  "id": "solo/quest/action",
  "title": "Quest Actions",
  "pillar": "solo",
  "tags": [
    "system-neutral"
  ],
  "credits": [
    {
      "source": "Storyteller Toolbox legacy solo tools (community expansions)"
    }
  ],
  "entries": [
    "Protect",
    "Assist",
    "Destroy",
    "Investigate",
    "Escort",
    "Rescue someone from",
    "Find or locate",
    "Escape from",
    "Smuggle",
    "Deceive",
    "Defeat",
    "Stop",
    "Capture",
    "Uncover the truth about",
    "Retrieve a sacred relic from",
    "Track down the elusive",
    "Solve the mystery of",
    "Secure an alliance with",
    "Unravel the secrets behind",
    "Outwit the cunning plans of",
    "Steal valuable information from",
    "Expose the corruption within",
    "Discover the whereabouts of",
    "Survive the deadly traps in",
    "Infiltrate the stronghold of",
    "Retrieve a rare and powerful artifact from",
    "Navigate through the treacherous terrain of",
    "Thwart the nefarious plot of",
    "Uncover the truth about the hidden origins of",
    "Retrieve a sacred relic from the clutches of",
    "Track down the elusive guardian of",
    "Solve the mystery of the ancient prophecy regarding",
    "Secure an alliance with the enigmatic leaders of",
    "Unravel the secrets behind the enigmatic disappearances in",
    "Outwit the cunning plans of the notorious mastermind",
    "Steal valuable information from the heavily fortified headquarters of",
    "Expose the corruption within the heart of",
    "Discover the whereabouts of the legendary lost city of",
    "Survive the deadly traps in the cursed catacombs of",
    "Infiltrate the stronghold of the merciless warlord",
    "Retrieve a rare and powerful artifact from the forbidden shrine of",
    "Navigate through the treacherous terrain of the perilous abyss of",
    "Thwart the nefarious plot of the malevolent sorcerer",
    "Silence the whispers and rumors surrounding",
    "Break the enchantment that conceals the true identity of",
    "Deliver a long-lost message to",
    "Decode the ancient map leading to",
    "Escape the grasp of the vengeful spirit haunting",
    "Defend the innocent villagers from the onslaught of",
    "Recover the stolen treasures taken by the notorious thieves' guild of",
    "Untangle the web of lies spun by the treacherous advisor to",
    "Retrieve the sacred artifacts scattered across",
    "Survive the trials of the mysterious labyrinth within",
    "Discover the fate of the long-lost expedition to",
    "Unlock the secrets of the enchanted scroll guarded by",
    "Overcome the enchanted guardians protecting",
    "Unveil the truth behind the vanishing ships in",
    "Retrieve the legendary weapon said to slay",
    "Survive the deadly challenges presented by the elemental spirits of",
    "Uncover the dark secrets concealed in the archives of",
    "Retrieve the lost research notes of the renowned scholar from",
    "Confront the ancient dragon rumored to guard",
    "Locate the entrance to the legendary underground city of",
    "Outsmart the elusive spy sent by the enemy to",
    "Protect the innocent villagers from the wrath of",
    "Survive the harsh blizzards and freezing temperatures in",
    "Unravel the conspiracy behind the political turmoil in",
    "Retrieve the ancient artifacts scattered among the ruins of",
    "Escape the clutches of the cursed maze within",
    "Secure the allegiance of the powerful elemental guardians of",
    "Expose the truth behind the haunted mansion of",
    "Retrieve the stolen magical relics from the cunning thief",
    "Survive the deadly trials set by the mysterious council of",
    "Uncover the secret behind the magical barrier protecting",
    "Defeat the formidable guardian blocking the path to",
    "Protect the sacred grove from the encroaching darkness of",
    "Survive the deadly challenges of the cursed temple within",
    "Investigate the strange occurrences plaguing the remote village of",
    "Retrieve the long-lost spellbook of the legendary mage from",
    "Escape the enchanted forest and its mesmerizing illusions",
    "Thwart the sinister plot orchestrated by the wicked warlock",
    "Uncover the truth behind the disappearance of the royal heir",
    "Retrieve the powerful crystal hidden within the treacherous mountain of",
    "Survive the deadly encounters in the forbidden jungle of"
  ]
}
