{
  "id": "gm/loot/map-marker-2",
  "title": "Map Second Markers",
  "pillar": "gm",
  "tags": [
    "fantasy"
  ],
  "credits": [
    {
      "source": "r/d100",
      "url": "https://www.reddit.com/r/d100/"
    },
    {
      "source": "r/BehindTheTables",
      "url": "https://www.reddit.com/r/BehindTheTables/"
    },
    {
      "source": "r/DnDBehindTheScreen",
      "url": "https://www.reddit.com/r/DnDBehindTheScreen/"
    },
    {
      "source": "DnDSpeak",
      "url": "http://dndspeak.com/"
    }
  ],
  "entries": [
    "rock shaped like a heart",
    "mountain shaped like a bird's head",
    "petrified forest",
    "salt lake",
    "dried up swampland",
    "broken bridge",
    "old abandoned mill",
    "the ruined tower of the famous mage",
    "the ancient cemetery",
    "the mossy limestone cliffs",
    "the old granite quarry",
    "the abandoned campgrounds",
    "the vandalized statue of the former ruler",
    "the crossroads",
    "the road marker pointing West",
    "minaret",
    "quicksand",
    "hills honeycombed with caves",
    "old King's Forest",
    "the ancient stone archway covered in vines",
    "the sparkling river winding through the valley",
    "the dilapidated castle perched atop the hill",
    "the fields of sunflowers stretching as far as the eye can see",
    "the towering waterfalls cascading down the rocky cliffside",
    "the eerie mist-covered moors with unknown secrets",
    "the mysterious standing stones arranged in a perfect circle",
    "the hidden oasis with lush vegetation and clear blue water",
    "the ancient battleground where legends once clashed",
    "the enormous tree with roots that form a natural bridge",
    "the abandoned windmill standing tall against the horizon",
    "the glistening cave walls adorned with shimmering crystals",
    "the secluded beach with smooth stones and seashells",
    "the sacred grove where rare and magical creatures dwell",
    "the labyrinthine catacombs with countless winding passages",
    "the hauntingly beautiful melody coming from a distant harp",
    "the mesmerizing display of colorful northern lights in the sky",
    "the peculiar rock formation resembling a sleeping giant",
    "the massive boulder balanced precariously on the edge of a cliff",
    "the serene pond with floating water lilies and croaking frogs",
    "the ancient tree stump with mysterious carvings all over it",
    "the remnants of an old shipwreck half-buried in the sand",
    "the hidden glade where fireflies illuminate the night sky",
    "the enigmatic rune-inscribed stone said to grant wisdom",
    "the towering sand dunes sculpted by the relentless wind",
    "the majestic ruins of a forgotten temple with ancient relics",
    "the majestic herd of wild horses galloping across the plains",
    "the shimmering mirage that dances on the horizon",
    "the eerie echo chamber hidden within a rocky cavern",
    "the ancient tree with branches forming a natural archway",
    "the sparkling emerald lake nestled between tall mountains",
    "the labyrinth of underground tunnels with ancient carvings",
    "the serene garden with exotic flowers and calming fountains",
    "the towering statue of a legendary hero overlooking the land",
    "the hidden hot springs with warm, healing waters",
    "the mystical cave with glowing crystals lining the walls",
    "the ancient stone steps leading to a hidden observatory",
    "the vast expanse of golden wheat fields swaying in the breeze",
    "the mysterious fog-covered marshland with strange lights",
    "the sunlit glen where rare creatures frolic in harmony",
    "the ancient battleground where tales of heroes were born",
    "the towering cliffs with breathtaking views of the sea below",
    "the tranquil pond where colorful koi fish swim gracefully",
    "the crumbling ruins of an old castle lost to time",
    "the mystical grove with trees that whisper ancient secrets",
    "the hidden cave with walls adorned in sparkling gemstones",
    "the ancient stone circle believed to have mystical powers",
    "the cascading waterfalls with rainbows forming in the mist",
    "the abandoned shipwreck entangled in a web of seaweed",
    "the majestic grove of ancient trees that touch the sky",
    "the towering ice cave with dazzling ice formations",
    "the quiet village where time seems to slow down",
    "the ancient ruins of a forgotten civilization",
    "the mysterious cave paintings that tell ancient stories",
    "the enchanted forest where trees come to life at night",
    "the tranquil meadow with a carpet of colorful wildflowers",
    "the vast desert with shifting sand dunes and mirages",
    "the hidden underground chamber filled with ancient treasures",
    "the ancient stone bridge spanning a roaring river",
    "the abandoned temple with mysterious symbols on its walls",
    "the peaceful oasis with palm trees and cool, clear water",
    "the eerie fog-covered graveyard with weathered tombstones",
    "the enchanting glade where fairies are said to dance at dusk",
    "the ancient well with water rumored to grant eternal life",
    "the remote waterfall hidden deep within the forest",
    "the sprawling vineyard with rows of ripe, juicy grapes",
    "the secluded cave with walls adorned in ancient hieroglyphs",
    "the towering lighthouse standing tall on a rocky coastline"
  ]
}
