{
  "id": "gm/loot/art-material",
  "title": "Art Materials",
  "pillar": "gm",
  "tags": ["fantasy"],
  "credits": [{ "source": "Storyteller Toolbox", "url": "https://storytellertoolbox.com/gm/art/" }],
  "entries": [
    "marble",
    "veined alabaster",
    "polished granite",
    "obsidian",
    "carved jade",
    "ivory",
    "ebony",
    "gilded oak",
    "weathered bronze",
    "hammered copper",
    "beaten gold",
    "tarnished silver",
    "electrum",
    "wrought iron",
    "fired terracotta",
    "glazed porcelain",
    "blown glass",
    "sea glass",
    "lapis lazuli",
    "malachite",
    "amber",
    "mother-of-pearl",
    "coral",
    "petrified wood",
    "woven silk",
    "dyed wool",
    "cracked lacquer",
    "cloisonné enamel",
    "moonstone-inlaid gold",
    "gem-encrusted silver, set with {table:gm/loot/gems}"
  ]
}
